ID,Title,type,address,valor,city,bedrooms,short_description,about_constructions,mapa,confort,vacancies,investments_repeater,imagem_principal,status
230854,"Lumini Clube Residencial",apartamento,"Rua Heitor de Oliveira, 200 - Vila Sul Americana, Carapicuíba - SP","R$ 260.000,00",carapicuiba,"a:1:{i:0;s:9:""2-quartos"";}","Comodidade, segurança e lazer completo em um único lugar. A sua casa! ","Seja bem-vindo(a) ao futuro dos empreendimentos, que une conforto, lazer completo e segurança
para você e sua família desfrutarem de momentos inesquecíveis.

Esta é a oportunidade perfeita para quem busca qualidade de vida em um espaço totalmente projetado para seu sossego.","<iframe src=""https://www.google.com/maps/embed?pb=!1m14!1m8!1m3!1d14632.568642778973!2d-46.8579665!3d-23.5273888!3m2!1i1024!2i768!4f13.1!3m3!1m2!1s0x94cf010e5e01bf8f%3A0x26e23a0579802146!2sLumini%20Clube%20Residencial!5e0!3m2!1spt-BR!2sbr!4v1699226184531!5m2!1spt-BR!2sbr"" width=""600"" height=""450"" style=""border:0;"" allowfullscreen="""" loading=""lazy"" referrerpolicy=""no-referrer-when-downgrade""></iframe>",,"a:1:{i:0;s:6:""1-vaga"";}",2,230859,"a:1:{i:0;s:7:""em-obra"";}"
230882,"Bless Armênia",apartamento,"R. Armênia, 510 - Pres. Altino, Osasco - SP","R$ 360.000,00",osasco,"a:2:{i:0;s:9:""2-quartos"";i:1;s:9:""3-quartos"";}","O marco das suas conquistas.","""Bless RSF Armênia foi criado para ser um lugar para viver e ser visto. Nosso entusiasmo criativo nos levou a compor um projeto com identidade, chegando a um resultado contemporâneo que combina conforto com sofisticação. O projeto foi cuidadosamente pensado para um público que valoriza boa arquitetura e que possui um olhar para o futuro."" Rodrigo Sobreiro - Arquiteto","<iframe src=""https://www.google.com/maps/embed?pb=!1m18!1m12!1m3!1d3658.1527709577813!2d-46.7663516!3d-23.5270071!2m3!1f0!2f0!3f0!3m2!1i1024!2i768!4f13.1!3m3!1m2!1s0x94ceff3d4cb0fee5%3A0x3b6abcea1edf9ac7!2sR.%20Arm%C3%AAnia%2C%20510%20-%20Pres.%20Altino%2C%20Osasco%20-%20SP%2C%2006210-138!5e0!3m2!1spt-BR!2sbr!4v1699296824428!5m2!1spt-BR!2sbr"" width=""600"" height=""450"" style=""border:0;"" allowfullscreen="""" loading=""lazy"" referrerpolicy=""no-referrer-when-downgrade""></iframe>",6,"a:2:{i:0;s:6:""1-vaga"";i:1;s:7:""2-vagas"";}",1,230911,"a:1:{i:0;s:7:""em-obra"";}"
230913,"Demais Bela Vista",apartamento,"R. José Gimenes Gomes, 294 - Vila Osasco, Osasco - SP","R$315.000,00",osasco,"a:1:{i:0;s:9:""2-quartos"";}","Você com Tudo Morando no Bela Vista!","DeMais é poder morar no melhor do Bela Vista!","<iframe src=""https://www.google.com/maps/embed?pb=!1m18!1m12!1m3!1d7315.84796023129!2d-46.78835240737586!3d-23.5352364652708!2m3!1f0!2f0!3f0!3m2!1i1024!2i768!4f13.1!3m3!1m2!1s0x94ceff3900ee23e5%3A0xd4931db822c1c76a!2sDemais%20Bela%20Vista!5e0!3m2!1spt-BR!2sbr!4v1699364320969!5m2!1spt-BR!2sbr"" width=""600"" height=""450"" style=""border:0;"" allowfullscreen="""" loading=""lazy"" referrerpolicy=""no-referrer-when-downgrade""></iframe>",2,"a:1:{i:0;s:6:""1-vaga"";}",3,230920,"a:1:{i:0;s:7:""em-obra"";}"
230948,Seleto,apartamento,"R. Ana Ventura Nitão, 288 - Ayrosa, Osasco - SP","R$ 280.000,00",osasco,"a:2:{i:0;s:8:""1-quarto"";i:1;s:9:""2-quartos"";}","O melhor de Osasco, perto de você.","O que era bom, agora ficou ainda melhor, morando perto de tudo.

O Seleto combina com o seu estilo, seja ele qual for. O projeto único na região, confere exclusividade e segurança. Desde a sua portaria, combina as mais modernas  tendências arquitetônicas em edifícios residenciais aos mais eficientes conceitos em privacidade, conforto e excelente localização conferindo ao conjunto personalidade única. ","<iframe src=""https://www.google.com/maps/embed?pb=!1m14!1m8!1m3!1d14633.450542641707!2d-46.7712613!3d-23.5194561!3m2!1i1024!2i768!4f13.1!3m3!1m2!1s0x94ceff964bac39ad%3A0xfee538abe3288036!2sSeleto%20Residencial%20Clube!5e0!3m2!1spt-BR!2sbr!4v1699379582645!5m2!1spt-BR!2sbr"" width=""600"" height=""450"" style=""border:0;"" allowfullscreen="""" loading=""lazy"" referrerpolicy=""no-referrer-when-downgrade""></iframe>",,"a:1:{i:0;s:6:""1-vaga"";}",2,230957,"a:1:{i:0;s:7:""em-obra"";}"
230964,"Saldanha Park 650",apartamento,"R. Antônio José Nurchis, 650 - Vila Yolanda, Osasco - SP, 06124-080","R$ 265.000,00",osasco,"a:2:{i:0;s:8:""1-quarto"";i:1;s:9:""2-quartos"";}","Perto de tudo o que você quer perto.","Uma região predominantemente residencial, mas que oferece em seu entorno uma variada infraestrutura de comércio e serviços.","<iframe src=""https://www.google.com/maps/embed?pb=!1m18!1m12!1m3!1d3657.5408031592383!2d-46.79890272582563!3d-23.54901286113641!2m3!1f0!2f0!3f0!3m2!1i1024!2i768!4f13.1!3m3!1m2!1s0x94ceff233839ca7b%3A0xaff6658f22c6219!2sPark%20650!5e0!3m2!1spt-BR!2sbr!4v1699382193430!5m2!1spt-BR!2sbr"" width=""600"" height=""450"" style=""border:0;"" allowfullscreen="""" loading=""lazy"" referrerpolicy=""no-referrer-when-downgrade""></iframe>",,"a:1:{i:0;s:6:""1-vaga"";}",4,230966,"a:1:{i:0;s:7:""em-obra"";}"
230983,"Canvas HUB 111",apartamento,"R. Manoel José de Santana, 111 - Vila Yara, São Paulo - SP, 06020-060","R$ 520.000,00",osasco,"a:2:{i:0;s:9:""2-quartos"";i:1;s:9:""3-quartos"";}","Próximo de importantes pontos da cidade.","Com otimização de espaço, cada detalhe é cuidadosamente projetado para oferecer bem-estar e conforto à sua família. ","<iframe src=""https://www.google.com/maps/embed?pb=!1m18!1m12!1m3!1d3657.5068699098474!2d-46.759052499999996!3d-23.5502325!2m3!1f0!2f0!3f0!3m2!1i1024!2i768!4f13.1!3m3!1m2!1s0x94ceff59b1249311%3A0x2af8e4429ee40f35!2sR.%20Manoel%20Jos%C3%A9%20de%20Santana%2C%20111%20-%20Vila%20Yara%2C%20S%C3%A3o%20Paulo%20-%20SP%2C%2006020-060!5e0!3m2!1spt-BR!2sbr!4v1699389425964!5m2!1spt-BR!2sbr"" width=""600"" height=""450"" style=""border:0;"" allowfullscreen="""" loading=""lazy"" referrerpolicy=""no-referrer-when-downgrade""></iframe>",6,"a:1:{i:0;s:6:""1-vaga"";}",3,230985,"a:1:{i:0;s:16:""breve-lancamento"";}"
231017,"Ekko Yard",apartamento,"Rua Conde Luiz Eduardo Matarazzo, Vila São Francisco, Osasco-SP","R$ 2.900.000,00",osasco,"a:2:{i:0;s:9:""3-quartos"";i:1;s:9:""4-quartos"";}","A sua melhor oportunidade de viver junto a natureza.","Um empreendimento com conforto, segurança em uma localização privilegiada. 
Afinal, somos parte de tudo aquilo que chamamos de natureza.","<iframe src=""https://www.google.com/maps/embed?pb=!1m14!1m8!1m3!1d578.2522755325228!2d-46.76080415122229!3d-23.56349118112546!3m2!1i1024!2i768!4f13.1!3m3!1m2!1s0x94ce55ee26e28223%3A0xe42ab4f9dbe2d66d!2sR.%20Lopez%20Portana%20-%20Rio%20Pequeno%2C%20S%C3%A3o%20Paulo%20-%20SP!5e0!3m2!1spt-BR!2sbr!4v1699402840349!5m2!1spt-BR!2sbr"" width=""600"" height=""450"" style=""border:0;"" allowfullscreen="""" loading=""lazy"" referrerpolicy=""no-referrer-when-downgrade""></iframe>",14,"a:1:{i:0;s:7:""4-vagas"";}",1,231034,"a:1:{i:0;s:16:""breve-lancamento"";}"
231041,"Zatz Vitrine",apartamento,"R. João Alves Pedroso, 258 - Santa Maria, Osasco - SP","R$ 230.000,00",osasco,"a:1:{i:0;s:9:""2-quartos"";}",Surpreenda-se,"Quando algo é muito belo, dizemos que merecia estar numa vitrine. 
Prepare-se, você vai se surpreender com o Vitrine by Zatz um verdadeiro clube de morar.","<iframe src=""https://www.google.com/maps/embed?pb=!1m18!1m12!1m3!1d3656.8961176829!2d-46.8128261235997!3d-23.5721741619917!2m3!1f0!2f0!3f0!3m2!1i1024!2i768!4f13.1!3m3!1m2!1s0x94ceff66cfaa07e5%3A0xfe2afdd1261826ab!2sVitrine%20by%20Zatz!5e0!3m2!1spt-BR!2sbr!4v1699459828895!5m2!1spt-BR!2sbr"" width=""600"" height=""450"" style=""border:0;"" allowfullscreen="""" loading=""lazy"" referrerpolicy=""no-referrer-when-downgrade""></iframe>",3,"a:1:{i:0;s:6:""1-vaga"";}",1,231059,"a:1:{i:0;s:7:""em-obra"";}"
231061,"Zatz Advanced",apartamento,"Av. Santo Antônio, 745 - Vila Osasco, Osasco - SP","R$ 280.000,00",osasco,"a:2:{i:0;s:9:""2-quartos"";i:1;s:8:""1-quarto"";}",Surpreenda-se,"Tenha o privilégio de morar com estilo, segurança, conforto e muita diversão deste autêntico resort no desejado bairro do Bela Vista.","<iframe src=""https://www.google.com/maps/embed?pb=!1m18!1m12!1m3!1d3657.882689372282!2d-46.78788232360074!3d-23.5367213606894!2m3!1f0!2f0!3f0!3m2!1i1024!2i768!4f13.1!3m3!1m2!1s0x94ceffc0e9d9597b%3A0xaffdbd0c95f3395b!2sAdvanced%20by%20Zatz!5e0!3m2!1spt-BR!2sbr!4v1699461608010!5m2!1spt-BR!2sbr"" width=""600"" height=""450"" style=""border:0;"" allowfullscreen="""" loading=""lazy"" referrerpolicy=""no-referrer-when-downgrade""></iframe>",3,"a:1:{i:0;s:6:""1-vaga"";}",2,231087,"a:1:{i:0;s:7:""em-obra"";}"
231088,"Ekko Live 3 e 4 Alpha - Casas",casa,"Av. Honório Álvares Penteado, 2016 - Colinas da Anhanguera, Santana de Parnaíba - SP","R$ 2.057.000,00",santana-do-parnaiba,"a:2:{i:0;s:9:""2-quartos"";i:1;s:9:""3-quartos"";}","O equilíbrio perfeito entre o luxo e a natureza","Casa e Apartamentos. Conceito de condomínio clube com casas gourmet, apartamentos e coberturas duplex. O cuidado e a consideração de todos os aspectos que fazem deste empreendimento algo único e especial. Ele se destaca a ênfase na experiência sensorial e emocional que os terão ao viver aqui, representando o cuidado e atenção que foi dedicada para criar um ambiente que estimule os sentidos.","<iframe src=""https://www.google.com/maps/embed?pb=!1m18!1m12!1m3!1d3660.208831658445!2d-46.84071412430448!3d-23.45293055761827!2m3!1f0!2f0!3f0!3m2!1i1024!2i768!4f13.1!3m3!1m2!1s0x94cefdd3f1110261%3A0x80bbcc5f384ca747!2sEkko%20Live%203%20Alphaville!5e0!3m2!1spt-BR!2sbr!4v1699552144662!5m2!1spt-BR!2sbr"" width=""600"" height=""450"" style=""border:0;"" allowfullscreen="""" loading=""lazy"" referrerpolicy=""no-referrer-when-downgrade""></iframe>",20,"a:3:{i:0;s:7:""3-vagas"";i:1;s:7:""2-vagas"";i:2;s:6:""1-vaga"";}",1,231128,"a:1:{i:0;s:7:""em-obra"";}"
231140,"Ekko Live 3 e 4 Alpha - Apartamentos",apartamento,"Av. Honório Álvares Penteado, 2016 - Colinas da Anhanguera, Santana de Parnaíba - SP","R$ 1.254.000,00",santana-do-parnaiba,"a:3:{i:0;s:9:""2-quartos"";i:1;s:9:""3-quartos"";i:2;s:9:""4-quartos"";}","O equilíbrio perfeito entre o luxo e a natureza","Casa e Apartamentos. Conceito de condomínio clube com casas gourmet, apartamentos e coberturas duplex. O cuidado e a consideração de todos os aspectos que fazem deste empreendimento algo único e especial. Ele se destaca a ênfase na experiência sensorial e emocional que os terão ao viver aqui, representando o cuidado e atenção que foi dedicada para criar um ambiente que estimule os sentidos.","<iframe src=""https://www.google.com/maps/embed?pb=!1m18!1m12!1m3!1d3660.208831658445!2d-46.84071412430448!3d-23.45293055761827!2m3!1f0!2f0!3f0!3m2!1i1024!2i768!4f13.1!3m3!1m2!1s0x94cefdd3f1110261%3A0x80bbcc5f384ca747!2sEkko%20Live%203%20Alphaville!5e0!3m2!1spt-BR!2sbr!4v1699552144662!5m2!1spt-BR!2sbr"" width=""600"" height=""450"" style=""border:0;"" allowfullscreen="""" loading=""lazy"" referrerpolicy=""no-referrer-when-downgrade""></iframe>",12,"a:2:{i:0;s:7:""3-vagas"";i:1;s:7:""2-vagas"";}",8,231130,"a:1:{i:0;s:7:""em-obra"";}"
231154,"Icon Residencial",apartamento,"R. Horácio Manley Lane, 153 - Raposo Tavares, Osasco - SP","R$ 500.000,00",osasco,"a:1:{i:0;s:9:""2-quartos"";}","Sinta-se em casa","Plantas com excelente aproveitamento de espaço e lazer completo.","<iframe src=""https://www.google.com/maps/embed?pb=!1m18!1m12!1m3!1d3656.465280063441!2d-46.811729799999995!3d-23.5876407!2m3!1f0!2f0!3f0!3m2!1i1024!2i768!4f13.1!3m3!1m2!1s0x94ce5546deb4c97d%3A0x992b34ff18360095!2sR.%20Hor%C3%A1cio%20Manley%20Lane%2C%20153%20-%20Raposo%20Tavares%2C%20Osasco%20-%20SP%2C%2006149-000!5e0!3m2!1spt-BR!2sbr!4v1699561047654!5m2!1spt-BR!2sbr"" width=""600"" height=""450"" style=""border:0;"" allowfullscreen="""" loading=""lazy"" referrerpolicy=""no-referrer-when-downgrade""></iframe>",3,"a:1:{i:0;s:6:""1-vaga"";}",6,231181,"a:1:{i:0;s:16:""breve-lancamento"";}"
231192,"Ekko Outline",apartamento,"Av. Santo Antônio, 1889 - Centro, Osasco - SP","R$ 660.000,00",osasco,"a:2:{i:0;s:8:""1-quarto"";i:1;s:9:""2-quartos"";}","Dentro ou fora, transmite sentimentos e expressa personalidade.","O conceito de personalidade dos ambientes da linha Ekko Group identifica seus hábitos e otimiza a maneira com que você interage com cada um deles. 

Em outras palavras: antecipamos suas necessidades, reprojetando espaços utilizados com pouca frequência, para que eles tornem-se, a cada dia, ainda mais a sua cara. 

Este conceito facilita o dia a dia, conecta pessoas e objetivos, e melhora a relação com a sua vida. 

Afinal, acreditamos e defendemos que: quanto mais o lar for a sua cara, mais você transforma ao seu redor.","<iframe src=""https://www.google.com/maps/embed?pb=!1m14!1m8!1m3!1d14630.885254405139!2d-46.7763257!3d-23.5425239!3m2!1i1024!2i768!4f13.1!3m3!1m2!1s0x94ceff139974d111%3A0xd20aecf2bb61b7af!2sOutline%20BY%20EKKO%20GROUP!5e0!3m2!1spt-BR!2sbr!4v1699615181543!5m2!1spt-BR!2sbr"" width=""600"" height=""450"" style=""border:0;"" allowfullscreen="""" loading=""lazy"" referrerpolicy=""no-referrer-when-downgrade""></iframe>",7,"a:1:{i:0;s:6:""1-vaga"";}",5,231193,"a:1:{i:0;s:7:""em-obra"";}"
231236,"Vista Golf",apartamento,"R. João Oxisque, 105 - Vila Yara, Osasco - SP","R$ 950.000,00",osasco,"a:2:{i:0;s:9:""2-quartos"";i:1;s:9:""3-quartos"";}","A sofisticação de viver bem.","Sofisticar é deixar refinado, ser elegante e ter estilo. E, na hora de escolher onde morar, sofisticado é viver ao lado da natureza, com qualidade de vida e em uma região que você escolheu para chamar de sua.

Quem conhece a Vila São Francisco, dificilmente resiste aos seus encantos. A cidade possui paisagens maravilhosas – e pode ser apreciada por diversos ângulos. Afinal, acreditamos e defendemos que: quanto melhor a sua relação com o seu bairro, mais você transforma o redor.","<iframe src=""https://www.google.com/maps/embed?pb=!1m18!1m12!1m3!1d3657.5133470866435!2d-46.76793920000001!3d-23.5499997!2m3!1f0!2f0!3f0!3m2!1i1024!2i768!4f13.1!3m3!1m2!1s0x94ceff67690fbeb1%3A0xb0e199730b63142!2sR.%20Jo%C3%A3o%20Oxisque%2C%20105%20-%20Vila%20Yara%2C%20Osasco%20-%20SP%2C%2006028-160!5e0!3m2!1spt-BR!2sbr!4v1699830969883!5m2!1spt-BR!2sbr"" width=""600"" height=""450"" style=""border:0;"" allowfullscreen="""" loading=""lazy"" referrerpolicy=""no-referrer-when-downgrade""></iframe>",5,"a:3:{i:0;s:6:""1-vaga"";i:1;s:7:""2-vagas"";i:2;s:7:""3-vagas"";}",5,231275,"a:1:{i:0;s:7:""em-obra"";}"
231305,"Ekko Alto da Mata",apartamento,"R. Conde Luiz Eduardo Matarazzo, 261 - Cidade São Francisco, Osasco - SP","R$ 1.700.000,00",osasco,"a:2:{i:0;s:9:""3-quartos"";i:1;s:9:""4-quartos"";}","A natureza está em cada um de nós.","É através dela que nos conectamos com as nossas raízes. Sentimos a nossa essência respirando o ar puro do alto da mata. E recarregamos as nossas energias ouvindo o canto que vem das árvores.

Quando o sol ilumina o céu, encontramos paz e tranquilidade. Passamos a viver a vida real, sem filtros.
Olhamos para dentro e enxergamos quem somos. E descobrimos um lugar onde podemos viver, sentir e nos conectar.","<iframe src=""https://www.google.com/maps/embed?pb=!1m14!1m8!1m3!1d14629.00811204341!2d-46.7645911!3d-23.5593902!3m2!1i1024!2i768!4f13.1!3m3!1m2!1s0x94ce55bcb8f883e9%3A0x4d8253e65fc12944!2sAlto%20da%20Mata!5e0!3m2!1spt-BR!2sbr!4v1699884495468!5m2!1spt-BR!2sbr"" width=""600"" height=""450"" style=""border:0;"" allowfullscreen="""" loading=""lazy"" referrerpolicy=""no-referrer-when-downgrade""></iframe>",7,"a:2:{i:0;s:7:""3-vagas"";i:1;s:7:""4-vagas"";}",3,231312,"a:1:{i:0;s:7:""em-obra"";}"
231337,"Reserva Golf Residencial",apartamento,"Av. Dr. Martin Luther King, 1520-1672 - Umuarama, Osasco - SP","R$ 2.100.000,00",osasco,"a:1:{i:0;s:9:""4-quartos"";}","Sofisticação e estilo com qualidade de vida."," São condomínios verticais de apartamentos de alto padrão que expressam sofisticação e estilo de vida, sem abrir mão da qualidade de vida, em uma localização privilegiada e estratégica. 

Este conceito BY EKKOGROUP facilita o dia a dia, conecta pessoas e objetivos, e melhora a relação com a sua vida. Afinal, acreditamos e defendemos que quanto mais o lar for a sua cara, mais você transforma ao seu redor.
","<iframe src=""https://www.google.com/maps/embed?pb=!1m14!1m8!1m3!1d14629.168471512248!2d-46.7651507!3d-23.5579498!3m2!1i1024!2i768!4f13.1!3m3!1m2!1s0x94ce55ddc973848d%3A0x545d5196f987980d!2sReserva%20Golf%20S%C3%A3o%20Francisco!5e0!3m2!1spt-BR!2sbr!4v1699933165042!5m2!1spt-BR!2sbr"" width=""600"" height=""450"" style=""border:0;"" allowfullscreen="""" loading=""lazy"" referrerpolicy=""no-referrer-when-downgrade""></iframe>",7,"a:2:{i:0;s:7:""3-vagas"";i:1;s:7:""4-vagas"";}",3,231341,"a:1:{i:0;s:7:""em-obra"";}"
231429,"Smart Flow",apartamento,"Av. José Lopes Lázaro, 318 - Pres. Altino, Osasco - SP","R$ 370.000,00",osasco,"a:3:{i:0;s:6:""studio"";i:1;s:8:""1-quarto"";i:2;s:9:""2-quartos"";}","O mais novo smart que nasceu da vontade de encurtar distâncias","Morar próximo à estações de trem e metrô, hoje, é sinônimo de exclusividade. Agora se essa estação for a extensão da sua casa, melhor ainda. Este conceito de mobilidade facilita trajetos, conecta pessoas e destinos, e melhora sua relação com a cidade.
Afinal, defendemos a liberdade de ir e vir porque acreditamos que: quanto mais tempo disponível, mais você transforma o redor.","<iframe src=""https://www.google.com/maps/embed?pb=!1m18!1m12!1m3!1d7316.0600482554955!2d-46.76776344169319!3d-23.53142251148628!2m3!1f0!2f0!3f0!3m2!1i1024!2i768!4f13.1!3m3!1m2!1s0x94ceff35ba5b565f%3A0x92e651bd4ea3c97!2sSmart%20Flow%20Altino!5e0!3m2!1spt-BR!2sbr!4v1699976611054!5m2!1spt-BR!2sbr"" width=""600"" height=""450"" style=""border:0;"" allowfullscreen="""" loading=""lazy"" referrerpolicy=""no-referrer-when-downgrade""></iframe>",7,"a:3:{i:0;s:7:""0-vagas"";i:1;s:6:""1-vaga"";i:2;s:7:""2-vagas"";}",2,231448,"a:1:{i:0;s:7:""em-obra"";}"
231457,"Smart Connect",apartamento,"R. Salém Bechara, 320 - Centro, Osasco - SP","R$ 370.000,00",osasco,"a:3:{i:0;s:6:""studio"";i:1;s:8:""1-quarto"";i:2;s:9:""2-quartos"";}","Você não precisa permanecer on-line para ficar conectado. ","Para atender uma nova geração que busca um estilo de vida aliado a praticidade e a comodidade, a linha SMART vem com um portfólio de produtos inteligentes, dinâmicos, modernos e compactos. Com ambientes integrados, desenvolvemos um empreendimento que foi projetado nos mínimos detalhes para um público conectado.
O conceito inteligente de integração dos ambientes da linha SMART reconhece seus hábitos e otimiza a maneira com que você interage com cada um deles. Em outras palavras: antecipamos suas necessidades, reprojetando espaços utilizados com pouca frequência, para que eles tornem-se, a cada dia, ainda mais funcionais. Este conceito facilita o dia a dia, conecta pessoas e objetivos, e melhora sua relação com a sua vida. Afinal, acreditamos e defendemos que: quanto mais tempo disponível, mais você transforma ao seu redor.","<iframe src=""https://www.google.com/maps/embed?pb=!1m18!1m12!1m3!1d3657.795325038845!2d-46.78016312361961!3d-23.539862860804757!2m3!1f0!2f0!3f0!3m2!1i1024!2i768!4f13.1!3m3!1m2!1s0x94ceff9047b07d1f%3A0xb6190d9f0891717!2sSmart%20Connect!5e0!3m2!1spt-BR!2sbr!4v1699978516272!5m2!1spt-BR!2sbr"" width=""600"" height=""450"" style=""border:0;"" allowfullscreen="""" loading=""lazy"" referrerpolicy=""no-referrer-when-downgrade""></iframe>",9,"a:3:{i:0;s:7:""0-vagas"";i:1;s:6:""1-vaga"";i:2;s:7:""2-vagas"";}",2,231482,"a:1:{i:0;s:7:""em-obra"";}"
231484,"Smart Golf",apartamento,"R. João Oxisque, 183 - Vila Yara, Osasco - SP","R$ 310.000,00",osasco,"a:3:{i:0;s:6:""studio"";i:1;s:8:""1-quarto"";i:2;s:9:""2-quartos"";}","Funcionalidade para quem enxerga longe","Ser smart é entender as suas necessidades e entregar as melhores soluções para deixa a vida ainda melhor. Conheça um novo conceito que redefine os espaços e dá mais liberdade para o seu estilo de vida.
São studios de 31m² com sala/dormitório integrados aos demais ambientes, ideais para quem deseja espaços dinâmicos e flexíveis.
Para quem não abre mão de conforto e lazer, aproveite facilidades como salão de festas, espaço gourmet, salão de jogos, sauna, SPA, academia e muito mais.
E para fechar em grande estilo, a localização precisa ser estratégica. O Smart Golf está na Vila Yara, um dos melhores bairros de Osasco, perto de estações de trem, da USP, shopping e supermercados.","<iframe src=""https://www.google.com/maps/embed?pb=!1m18!1m12!1m3!1d3657.507157567196!2d-46.76979132361946!3d-23.550222161185026!2m3!1f0!2f0!3f0!3m2!1i1024!2i768!4f13.1!3m3!1m2!1s0x94ceff83a0fba679%3A0xa35efecc8716e77c!2sSmart%20Golf!5e0!3m2!1spt-BR!2sbr!4v1699980600220!5m2!1spt-BR!2sbr"" width=""600"" height=""450"" style=""border:0;"" allowfullscreen="""" loading=""lazy"" referrerpolicy=""no-referrer-when-downgrade""></iframe>",10,"a:3:{i:0;s:7:""0-vagas"";i:1;s:6:""1-vaga"";i:2;s:7:""2-vagas"";}",7,231498,"a:1:{i:0;s:7:""em-obra"";}"
231590,"Smart Sky",apartamento,"R. Machado de Assis, 735 - Centro, Osasco - SP","R$ 300.000,00",osasco,"a:3:{i:0;s:6:""studio"";i:1;s:8:""1-quarto"";i:2;s:9:""2-quartos"";}","O verdadeiro lazer nas alturas","Morar no Smart Sky Bela Vista é ter um rooftop de tirar o fôlego para você viver momentos inesquecíveis. O projeto oferece elegância e bem-estar, em uma região dinâmica e com tudo ao seu alcance. Grandes momentos acontecem quando sonhamos alto, sobretudo, em um lugar acolhedor e belo até no nome.","<iframe src=""https://www.google.com/maps/embed?pb=!1m18!1m12!1m3!1d3657.820835558485!2d-46.781302224670505!3d-23.538945578815238!2m3!1f0!2f0!3f0!3m2!1i1024!2i768!4f13.1!3m3!1m2!1s0x94ceff0d0549af5f%3A0x10c56494cc2eb3b0!2sR.%20Machado%20de%20Assis%2C%20735%20-%20Centro%2C%20Osasco%20-%20SP%2C%2016480-011!5e0!3m2!1spt-BR!2sbr!4v1700148199353!5m2!1spt-BR!2sbr"" width=""600"" height=""450"" style=""border:0;"" allowfullscreen="""" loading=""lazy"" referrerpolicy=""no-referrer-when-downgrade""></iframe>",11,"a:3:{i:0;s:7:""0-vagas"";i:1;s:6:""1-vaga"";i:2;s:7:""2-vagas"";}",3,231616,"a:1:{i:0;s:7:""em-obra"";}"
231617,"Smart Moment",apartamento,"Av. Santo Antônio, 1218 - Vila Osasco, Osasco - SP","R$ 490.000,00",osasco,"a:3:{i:0;s:8:""1-quarto"";i:1;s:9:""2-quartos"";i:2;s:9:""3-quartos"";}","Feito para a sua família aproveitar os bons momentos.","O Smart Moment Bela Vista oferece comodidade e lazer completo, em uma região dinâmica e com tudo ao seu alcance. Desfrute novas experiências com as melhores companhias em um lugar acolhedor e belo até no nome.","<iframe src=""https://www.google.com/maps/embed?pb=!1m18!1m12!1m3!1d3657.823909111466!2d-46.78372892361982!3d-23.53883506076694!2m3!1f0!2f0!3f0!3m2!1i1024!2i768!4f13.1!3m3!1m2!1s0x94ceff6cb40d4d1d%3A0xab119a977c84a6e2!2sSmart%20Moment%20Bela%20Vista!5e0!3m2!1spt-BR!2sbr!4v1700158465262!5m2!1spt-BR!2sbr"" width=""600"" height=""450"" style=""border:0;"" allowfullscreen="""" loading=""lazy"" referrerpolicy=""no-referrer-when-downgrade""></iframe>",10,"a:2:{i:0;s:6:""1-vaga"";i:1;s:7:""2-vagas"";}",5,231644,"a:1:{i:0;s:7:""em-obra"";}"
231647,"Smart Soul",apartamento,"Av. Santo Antônio, 1045 - Jardim Bela Vista, Osasco - SP","R$ 490.000,00",osasco,"a:2:{i:0;s:8:""1-quarto"";i:1;s:9:""2-quartos"";}","Descubra emoções em um Smart pensado para o seu novo momento.","Bem-estar, praticidade e lazer completo são algumas das características do Smart Soul Bela Vista, localizado em uma região dinâmica e que é bela até no nome. Desfrute do lugar ideal para você e sua família construírem uma nova história.

","<iframe src=""https://www.google.com/maps/embed?pb=!1m18!1m12!1m3!1d3657.7240627525985!2d-46.77981942361969!3d-23.54242506089881!2m3!1f0!2f0!3f0!3m2!1i1024!2i768!4f13.1!3m3!1m2!1s0x94cefff38255d0af%3A0xdd778c97f7910820!2sSmart%20Soul%20Bela%20Vista!5e0!3m2!1spt-BR!2sbr!4v1700159245685!5m2!1spt-BR!2sbr"" width=""600"" height=""450"" style=""border:0;"" allowfullscreen="""" loading=""lazy"" referrerpolicy=""no-referrer-when-downgrade""></iframe>",10,"a:2:{i:0;s:6:""1-vaga"";i:1;s:7:""2-vagas"";}",2,231668,"a:1:{i:0;s:7:""em-obra"";}"
232001,Florà,apartamento,"Alameda Walker, 139 - Alphaville Empresarial, Barueri - SP","R$ 6.720.000,00",barueri,"a:2:{i:0;s:9:""3-quartos"";i:1;s:9:""4-quartos"";}","Além do extraordinário","Transcendemos o inimaginável e redefinimos o conceito de sofisticação e exclusividade em Alphaville.
Um empreendimento inspirado na natureza dentro de um condomínio fechado, em uma tranquila rua sem saída, integrado a uma área de preservação ambiental de 22 mil m². Um lugar para se conectar com o verde e desfrutar de prazeres e experiências exclusivas de alto padrão que despertam os sentidos e agradam a alma.","<iframe src=""https://www.google.com/maps/embed?pb=!1m18!1m12!1m3!1d914.8044095389118!2d-46.861959030349!3d-23.4886691686986!2m3!1f0!2f0!3f0!3m2!1i1024!2i768!4f13.1!3m3!1m2!1s0x94cf024b9b9d6fa9%3A0xf9d34722970c87bb!2sAlameda%20Walker%20-%20Alphaville%20Empresarial%2C%20Barueri%20-%20SP!5e0!3m2!1spt-BR!2sbr!4v1701884082705!5m2!1spt-BR!2sbr"" width=""600"" height=""450"" style=""border:0;"" allowfullscreen="""" loading=""lazy"" referrerpolicy=""no-referrer-when-downgrade""></iframe>",10,"a:2:{i:0;s:7:""5-vagas"";i:1;s:8:""+6-vagas"";}",2,232021,"a:1:{i:0;s:7:""em-obra"";}"
