ID,Title,type,address,valor,city,bedrooms,short_description,about_constructions,mapa,confort,vacancies,investments_repeater,imagem_principal,status
232034,"We Novo Osasco",apartamento,"R. Aparecida Ivone Munhoz, 418 - Novo Osasco, Osasco - SP","R$ 180.000,00",osasco,"a:2:{i:0;s:8:""1-quarto"";i:1;s:9:""2-quartos"";}","Um lugar tranquilo e prático, perto de tudo o que sua família mais precisa.","Excelente oportunidade de residência em proximidade a importantes rodovias, facilitando o acesso a uma variedade de locais essenciais, tais como escolas, clubes, renomadas lojas, supermercados, shoppings e serviços públicos. 

Além disso, a localização proporciona um acesso descomplicado à Rodovia Presidente Castelo Branco e ao Rodoanel, conferindo praticidade e conveniência aos moradores.","<iframe src=""https://www.google.com/maps/embed?pb=!1m14!1m8!1m3!1d14628.114843983833!2d-46.7967434!3d-23.5674123!3m2!1i1024!2i768!4f13.1!3m3!1m2!1s0x94ce556834f8daef%3A0x6e6856230a91500a!2sWe%20Novo%20Osasco!5e0!3m2!1spt-BR!2sbr!4v1702075442848!5m2!1spt-BR!2sbr"" width=""600"" height=""450"" style=""border:0;"" allowfullscreen="""" loading=""lazy"" referrerpolicy=""no-referrer-when-downgrade""></iframe>",1,"a:2:{i:0;s:7:""0-vagas"";i:1;s:6:""1-vaga"";}",2,232046,"a:1:{i:0;s:7:""em-obra"";}"
232049,Ilumini,apartamento,"R. Antônia Bizarro, 333 - Vila Osasco, Osasco - SP","R$ 665.000,00",osasco,"a:2:{i:0;s:9:""2-quartos"";i:1;s:9:""3-quartos"";}","Para brilhar nos céus do Bela Vista.","Concebido em um projeto com áreas extremamente iluminadas, o EDIFÍDIO ILUMINI BELA VISTA traduz verdadeiramente o sentido da palavra “luz própria”. Assim como um girassol que se posiciona em direção a luz, os ambientes do ILUMINI foram concebidos para serem contemplados por imensa ventilação e iluminação natural. 

Um projeto charmoso e sofisticado, de arquitetura moderna, para recepcionar e fazer brilhar seus caminhos todos os dias em que você volta para casa. Segurança planejada e lazer para todos os gostos e idades, com áreas para curtir sua liberdade em um belo dia de sol, são pontos marcantes no ILUMINI.
Plantas amplas e confortáveis, todas com varanda grill, são beneficiadas por imensa luz natural e clareiam sua vida com um toque de sofisticação.","<iframe src=""https://www.google.com/maps/embed?pb=!1m18!1m12!1m3!1d3657.7959717852164!2d-46.7863012197032!3d-23.539839606156026!2m3!1f0!2f0!3f0!3m2!1i1024!2i768!4f13.1!3m3!1m2!1s0x94ceff0c848e4cbd%3A0x9be100eed1ef1aa5!2sR.%20Ant%C3%B4nia%20Bizarro%2C%20333%20-%20Vila%20Osasco%2C%20Osasco%20-%20SP%2C%2006083-160!5e0!3m2!1spt-BR!2sbr!4v1702081980137!5m2!1spt-BR!2sbr"" width=""600"" height=""450"" style=""border:0;"" allowfullscreen="""" loading=""lazy"" referrerpolicy=""no-referrer-when-downgrade""></iframe>",7,"a:2:{i:0;s:6:""1-vaga"";i:1;s:7:""2-vagas"";}",2,232050,"a:1:{i:0;s:7:""em-obra"";}"
