ID,Title,type,address,valor,city,bedrooms,short_description,about_constructions,mapa,confort,vacancies,investments_repeater,imagem_principal,status
229720,Legend,apartamento,"R. Antônia Bizarro, 163 - Vila Osasco, Osasco - SP","R$ 840.000,00",osasco,"a:2:{i:0;s:9:""2-quartos"";i:1;s:9:""3-quartos"";}","Nosso legado fará parte da sua história","Nascemos anônimos para construir nosso próprio destino e fazermos da nossa jornada, uma bela história!
Inspirados por espaços grandiosos e por realização de sonhos, chegamos a um importante momento do nosso legado!","<iframe src=""https://www.google.com/maps/embed?pb=!1m18!1m12!1m3!1d3657.7724497020536!2d-46.78275602360073!3d-23.54068536083492!2m3!1f0!2f0!3f0!3m2!1i1024!2i768!4f13.1!3m3!1m2!1s0x94ceff0ccf4c0fa5%3A0x893ebeac6b943c77!2sR.%20Ant%C3%B4nia%20Bizarro%2C%20163%20-%20Vila%20Osasco%2C%20Osasco%20-%20SP%2C%2006083-160!5e0!3m2!1spt-BR!2sbr!4v1698089846203!5m2!1spt-BR!2sbr"" width=""600"" height=""450"" style=""border:0;"" allowfullscreen="""" loading=""lazy"" referrerpolicy=""no-referrer-when-downgrade""></iframe>",16,"a:2:{i:0;s:7:""2-vagas"";i:1;s:7:""3-vagas"";}",2,230578,"a:1:{i:0;s:16:""breve-lancamento"";}"
229863,Fiori,apartamento,"Av. Copacabana, 525 - Empresarial 18 do Forte, Barueri - SP","R$ 480.000,00",barueri,"a:1:{i:0;s:8:""1-quarto"";}","Viva o poder da natureza","Inspirado nos projetos mais premiados do mundo, no melhor bairro de Alphaville, em frente ao parque 18 do forte. Glamour e sofisticação.
Morar no Fiori Alphaville é estar rodeado pelo que há de melhor em segurança, qualidade de vida, sofisticação e facilidades.
A região conta com a excelência em educação, gastronomia e lazer privilegiado pelo belo parque de 22 mil m2 de área verde.
O ELO PERFEITO ENTRE A SOFISTICAÇÃO, VOCÊ E A NATUREZA.","<iframe src=""https://www.google.com/maps/embed?pb=!1m18!1m12!1m3!1d3659.3201030300074!2d-46.8553517236022!3d-23.484977058792374!2m3!1f0!2f0!3f0!3m2!1i1024!2i768!4f13.1!3m3!1m2!1s0x94cf039d9c73502f%3A0xd3d3bbdde12e0f5f!2sFiori%20Alphaville!5e0!3m2!1spt-BR!2sbr!4v1698353145911!5m2!1spt-BR!2sbr"" width=""600"" height=""450"" style=""border:0;"" allowfullscreen="""" loading=""lazy"" referrerpolicy=""no-referrer-when-downgrade""></iframe>",4,"a:2:{i:0;s:7:""0-vagas"";i:1;s:6:""1-vaga"";}",3,229879,"a:1:{i:0;s:7:""em-obra"";}"
229864,Shape,apartamento," Av. Copacabana, 394 - Empresarial 18 do Forte - Alphaville, Barueri - SP","R$ 520.000,00",barueri,"a:2:{i:0;s:8:""1-quarto"";i:1;s:9:""2-quartos"";}","Disruptivos, inquietos, apaixonados e inovadores","Desafiamos as leis da arquitetura e criamos um empreendimento icônico e atemporal","<iframe src=""https://www.google.com/maps/embed?pb=!1m14!1m8!1m3!1d7318.616676840883!2d-46.853027!3d-23.485401!3m2!1i1024!2i768!4f13.1!3m3!1m2!1s0x94cf02467374a9e5%3A0x2e80d22bbb3dc72e!2sAv.%20Copacabana%2C%20500%20-%20Empresarial%2018%20do%20Forte%2C%20Barueri%20-%20SP%2C%2013104-082!5e0!3m2!1spt-BR!2sbr!4v1698353559852!5m2!1spt-BR!2sbr"" width=""600"" height=""450"" style=""border:0;"" allowfullscreen="""" loading=""lazy"" referrerpolicy=""no-referrer-when-downgrade""></iframe>",2,"a:2:{i:0;s:6:""1-vaga"";i:1;s:7:""2-vagas"";}",3,229866,"a:1:{i:0;s:6:""pronto"";}"
229928,"On The Park",apartamento,"Av. Andrômeda, 2.000 - Alphaville, Barueri - SP","R$ 660.000,00",barueri,"a:3:{i:0;s:8:""1-quarto"";i:1;s:9:""2-quartos"";i:2;s:9:""3-quartos"";}","Seu mundo visto de cima.","O privilégio de ter um parque aos seus pés e uma vista extraordinária.","<iframe src=""https://www.google.com/maps/embed?pb=!1m18!1m12!1m3!1d3659.2800117925576!2d-46.8729992746722!3d-23.486421728851358!2m3!1f0!2f0!3f0!3m2!1i1024!2i768!4f13.1!3m3!1m2!1s0x94cf03ae023407f1%3A0x6b23cdec4ea861d4!2sGreen%20Valley%20Office%20Park!5e0!3m2!1spt-BR!2sbr!4v1698693952678!5m2!1spt-BR!2sbr"" width=""600"" height=""450"" style=""border:0;"" allowfullscreen="""" loading=""lazy"" referrerpolicy=""no-referrer-when-downgrade""></iframe>",5,"a:3:{i:0;s:7:""0-vagas"";i:1;s:6:""1-vaga"";i:2;s:7:""2-vagas"";}",5,229939,"a:1:{i:0;s:7:""em-obra"";}"
229929,Oásis,apartamento,"Al. Washington, 824 - Alphaville, Barueri - SP","R$ 780.000,00",barueri,"a:2:{i:0;s:8:""1-quarto"";i:1;s:9:""2-quartos"";}","Um oásis pra você chamar de seu","Crie histórias únicas no Oásis, o verdadeiro paraíso
Um paraíso inserido em um ambiente de natureza exuberante.
O design elegante e atemporal do Oásis, com suas linhas orgânicas e sua imponência, tem inspiração nos resorts mais sofisticados do mundo.
","<iframe src=""https://www.google.com/maps/embed?pb=!1m18!1m12!1m3!1d3659.214571553433!2d-46.865524023602!3d-23.488779658931687!2m3!1f0!2f0!3f0!3m2!1i1024!2i768!4f13.1!3m3!1m2!1s0x94cf03f8f822d859%3A0x140462401b3db493!2sOASIS%20HOME%20RESORT%20-%20CNA%20SPITALETTI!5e0!3m2!1spt-BR!2sbr!4v1698696788453!5m2!1spt-BR!2sbr"" width=""600"" height=""450"" style=""border:0;"" allowfullscreen="""" loading=""lazy"" referrerpolicy=""no-referrer-when-downgrade""></iframe>",7,"a:2:{i:0;s:6:""1-vaga"";i:1;s:7:""2-vagas"";}",5,229994,"a:1:{i:0;s:7:""em-obra"";}"
230039,Singular,casa,"Av. Marcos Penteado de Ulhôa Rodrigues, 3095, Santana de Parnaíba - SP","R$ 2.760.000,00",santana-do-parnaiba,"a:3:{i:0;s:9:""3-quartos"";i:1;s:9:""2-quartos"";i:2;s:9:""4-quartos"";}","Naturalmente do seu jeito","Um lugar repleto de personalidade inspirado em uma identidade única: a sua.
","<iframe src=""https://www.google.com/maps/embed?pb=!1m18!1m12!1m3!1d4770.161133076364!2d-46.8461592236025!3d-23.46681485812756!2m3!1f0!2f0!3f0!3m2!1i1024!2i768!4f13.1!3m3!1m2!1s0x94cf02f53870c3af%3A0xce44ce3089f03b27!2sAv.%20Marcos%20Penteado%20de%20Ulh%C3%B4a%20Rodrigues%2C%203095%2C%20Santana%20de%20Parna%C3%ADba%20-%20SP!5e1!3m2!1spt-BR!2sbr!4v1698758313854!5m2!1spt-BR!2sbr"" width=""600"" height=""450"" style=""border:0;"" allowfullscreen="""" loading=""lazy"" referrerpolicy=""no-referrer-when-downgrade""></iframe>",14,"a:3:{i:0;s:7:""3-vagas"";i:1;s:7:""2-vagas"";i:2;s:7:""4-vagas"";}",2,230067,"a:1:{i:0;s:7:""em-obra"";}"
230070,"Hum Bela vista",apartamento,"R. Padre Donizete, 234 - Cipava, Osasco - SP","R$ 250.000,00",osasco,"a:2:{i:0;s:8:""1-quarto"";i:1;s:9:""2-quartos"";}","Charme e Facilidade como nenhum outro","O Hum Bela vista foi planejado para facilitar o dia a dia e otimizar seu tempo, reunindo em uma única torre espaços modernos em 4 complexos de lazer integrado, em conceito aberto e opções de plantas Loft, Apartamentos com 1 ou 2 Suítes e Duplex.","<iframe src=""https://www.google.com/maps/embed?pb=!1m14!1m8!1m3!1d14630.581960042531!2d-46.7854331!3d-23.5452498!3m2!1i1024!2i768!4f13.1!3m3!1m2!1s0x94ceff6d99fae437%3A0x6284a143ce9ff7f4!2sHUM%20Bela%20Vista!5e0!3m2!1spt-BR!2sbr!4v1698848891074!5m2!1spt-BR!2sbr"" width=""600"" height=""450"" style=""border:0;"" allowfullscreen="""" loading=""lazy"" referrerpolicy=""no-referrer-when-downgrade""></iframe>",1,"a:2:{i:0;s:6:""1-vaga"";i:1;s:7:""2-vagas"";}",2,230431,"a:1:{i:0;s:7:""em-obra"";}"
230281,"Residencial Aut 2750",apartamento,"Av. dos Autonomistas, 2750 - Vila Yara, Osasco - SP","R$ 216.000,00",osasco,"a:2:{i:0;s:9:""2-quartos"";i:1;s:8:""1-quarto"";}","Sinta a vibração da cidade.","Toda avenida tem seu ícone. A Autonomistas acaba de ganhar o seu. 
Um projeto envolvente para encantar e surpreender seus convidados a todo momento.
Ambientes agradáveis, para conversar, relaxar ou simplesmente contemplar.
","<iframe src=""https://www.google.com/maps/embed?pb=!1m18!1m12!1m3!1d3657.88110102958!2d-46.78213962467066!3d-23.53677847881674!2m3!1f0!2f0!3f0!3m2!1i1024!2i768!4f13.1!3m3!1m2!1s0x94ceff0c32df6a89%3A0x6e2d7a43974c25ec!2sAv.%20dos%20Autonomistas%2C%202750%20-%20Vila%20Yara%2C%20Osasco%20-%20SP%2C%2006090-010!5e0!3m2!1spt-BR!2sbr!4v1698848630799!5m2!1spt-BR!2sbr"" width=""600"" height=""450"" style=""border:0;"" allowfullscreen="""" loading=""lazy"" referrerpolicy=""no-referrer-when-downgrade""></iframe>",1,"a:3:{i:0;s:7:""0-vagas"";i:1;s:6:""1-vaga"";i:2;s:7:""2-vagas"";}",2,230298,"a:1:{i:0;s:7:""em-obra"";}"
230347,"HM Smart",apartamento,"Av. José Lourenço, 284 - Jaguaribe, Osasco - SP","R$ 220.000,00",osasco,"a:2:{i:0;s:8:""1-quarto"";i:1;s:9:""2-quartos"";}","Tudo o que sua família precisa no ponto mais valorizado da cidade!","No HM Smart Osasco você aproveita momentos incríveis sem precisar sair de casa, com uma diversidade de lazer para agradar a todas as idades e surpreender em qualquer ocasião.","<iframe src=""https://www.google.com/maps/embed?pb=!1m14!1m8!1m3!1d14629.231414864058!2d-46.7830963!3d-23.5573844!3m2!1i1024!2i768!4f13.1!3m3!1m2!1s0x94ceff075ef03cd5%3A0xcb874464d821bd76!2sHM%20Smart%20Osasco!5e0!3m2!1spt-BR!2sbr!4v1698855105427!5m2!1spt-BR!2sbr"" width=""600"" height=""450"" style=""border:0;"" allowfullscreen="""" loading=""lazy"" referrerpolicy=""no-referrer-when-downgrade""></iframe>",1,"a:2:{i:0;s:6:""1-vaga"";i:1;s:7:""2-vagas"";}",2,230349,"a:1:{i:0;s:7:""em-obra"";}"
230365,Epic,apartamento,"R. Jubair Celestino, 63 - Pres. Altino, Osasco - SP","R$ 420.000,00",osasco,"a:2:{i:0;s:8:""1-quarto"";i:1;s:9:""2-quartos"";}","Grandioso como seu nome","Sinta a cidade pulsar em sua volta.
Sofisticação e segurança a altura do seu bem-estar.
Localização que emana praticidade e conforto, cercada de uma ampla e diversificada infraestrutura de comércio, serviços e lazer. Para você que valoriza estar perto onde a vida acontece.","<iframe src=""https://www.google.com/maps/embed?pb=!1m18!1m12!1m3!1d2277.7170361164913!2d-46.77294025403167!3d-23.523264372960384!2m3!1f0!2f0!3f0!3m2!1i1024!2i768!4f13.1!3m3!1m2!1s0x94ceff1c1bd0007f%3A0xfbd1d13c10d75d1d!2sR.%20Jubair%20Celestino%2C%2063%20-%20Pres.%20Altino%2C%20Osasco%20-%20SP%2C%2006216-160!5e0!3m2!1spt-BR!2sbr!4v1698860594698!5m2!1spt-BR!2sbr"" width=""600"" height=""450"" style=""border:0;"" allowfullscreen="""" loading=""lazy"" referrerpolicy=""no-referrer-when-downgrade""></iframe>",10,"a:2:{i:0;s:6:""1-vaga"";i:1;s:7:""2-vagas"";}",2,230413,"a:1:{i:0;s:7:""em-obra"";}"
230368,"Breeze Residencial",apartamento,"Rua Paulo Emydio Pereira, 40 - Bela Vista, Osasco - SP","R$ 460.000,00",osasco,"a:2:{i:0;s:8:""1-quarto"";i:1;s:9:""2-quartos"";}","Conheça outro jeito de investir em imóveis...","Apartamentos com preço abaixo do mercado.","<iframe src=""https://www.google.com/maps/embed?pb=!1m18!1m12!1m3!1d14655.953577311426!2d-46.78639734441357!3d-23.545278548346076!2m3!1f0!2f0!3f0!3m2!1i1024!2i768!4f13.1!3m3!1m2!1s0x94ceff6fd1ce281b%3A0x2a4d7e7cd093fe97!2sRua%20Paulo%20Emydio%20Pereira%2C%2040%20-%20Bela%20Vista%2C%20Osasco%20-%20SP%2C%2006070-200!5e0!3m2!1spt-BR!2sbr!4v1698859644356!5m2!1spt-BR!2sbr"" width=""600"" height=""450"" style=""border:0;"" allowfullscreen="""" loading=""lazy"" referrerpolicy=""no-referrer-when-downgrade""></iframe>",8,"a:1:{i:0;s:6:""1-vaga"";}",1,230375,"a:1:{i:0;s:7:""em-obra"";}"
230432,"Aquarela Home",apartamento,"R. Adolpho Bozzi, 132 - Vila Osasco, Osasco - SP","R$ 450.000,00",osasco,"a:2:{i:0;s:8:""1-quarto"";i:1;s:9:""2-quartos"";}","Seu novo lar no coração de Osasco","O Aquarela Home Osasco oferece espaços harmoniosos e funcionais, com diversas áreas comuns. Cada detalhe foi planejado visando o seu conforto e comodidade, criando um ambiente aconchegante para você e sua família.","<iframe src=""https://www.google.com/maps/embed?pb=!1m18!1m12!1m3!1d3657.8988706594178!2d-46.786825523600804!3d-23.536139460668206!2m3!1f0!2f0!3f0!3m2!1i1024!2i768!4f13.1!3m3!1m2!1s0x94ceff09a64a72a1%3A0xa461d869369b9413!2sR.%20Adolpho%20Bozzi%2C%20132%20-%20Vila%20Osasco%2C%20Osasco%20-%20SP%2C%2006086-120!5e0!3m2!1spt-BR!2sbr!4v1698933992696!5m2!1spt-BR!2sbr"" width=""600"" height=""450"" style=""border:0;"" allowfullscreen="""" loading=""lazy"" referrerpolicy=""no-referrer-when-downgrade""></iframe>",13,"a:1:{i:0;s:6:""1-vaga"";}",1,230449,"a:1:{i:0;s:7:""em-obra"";}"
230451,"Raro Vila Isabel",apartamento,"R. São Jorge, 613 - Pestana, Osasco - SP","R$ 240.000,00",osasco,"a:1:{i:0;s:9:""2-quartos"";}","Conforto, comodidade, segurança e lazer em um só lugar!","Descubra o RARO Vila Isabel em Osasco. Apartamentos de 2 dormitórios com varanda gourmet e vaga de garagem. Localizado em uma rua tranquila, oferece comodidades como piscinas, salão de festas, fitness e playground. Viva a qualidade de vida no RARO Vila Isabel!","<iframe src=""https://www.google.com/maps/embed?pb=!1m18!1m12!1m3!1d1249.1935904855777!2d-46.80402063385343!3d-23.53780112734374!2m3!1f0!2f0!3f0!3m2!1i1024!2i768!4f13.1!3m3!1m2!1s0x94ceff6265f0ba2b%3A0xb2df5ee61ebba951!2sRARO%20Vila%20Isabel!5e0!3m2!1spt-BR!2sbr!4v1698936781699!5m2!1spt-BR!2sbr"" width=""600"" height=""450"" style=""border:0;"" allowfullscreen="""" loading=""lazy"" referrerpolicy=""no-referrer-when-downgrade""></iframe>",13,"a:1:{i:0;s:6:""1-vaga"";}",2,230468,"a:1:{i:0;s:7:""em-obra"";}"
230470,"Orla Condomínio Praia",apartamento,"R. Pernambucana, 670 - Conceicao, Osasco - SP","R$ 240.000,00",osasco,"a:2:{i:0;s:8:""1-quarto"";i:1;s:9:""2-quartos"";}","Viva com os pés na areia sem precisar sair de casa!","A tranquilidade e a segurança de morar em um condomínio fechado com a exclusividade de ter uma praia particular aos seus pés.","<iframe src=""https://www.google.com/maps/embed?pb=!1m14!1m8!1m3!1d1828.4609821442325!2d-46.80738846430501!3d-23.57124599654976!3m2!1i1024!2i768!4f13.1!3m3!1m2!1s0x94ce555fcd19682d%3A0x6711b820d0151fa5!2sR.%20Pernambucana%2C%20670%20-%20Conceicao%2C%20Osasco%20-%20SP%2C%2006140-040%2C%20Brasil!5e0!3m2!1spt-BR!2sus!4v1699016139910!5m2!1spt-BR!2sus"" width=""600"" height=""450"" style=""border:0;"" allowfullscreen="""" loading=""lazy"" referrerpolicy=""no-referrer-when-downgrade""></iframe>",2,"a:1:{i:0;s:6:""1-vaga"";}",3,230478,"a:1:{i:0;s:7:""em-obra"";}"
230503,"PIN Osasco",apartamento,"Av. Sarah Veloso, 1301 - Metalúrgicos, Osasco - SP","R$ 150.000,00",osasco,"a:3:{i:0;s:8:""1-quarto"";i:1;s:9:""2-quartos"";i:2;s:9:""3-quartos"";}","Vem que uma nova vida te espera!","Venha viver em um lugar cercado de facilidades.","<iframe src=""https://www.google.com/maps/embed?pb=!1m14!1m8!1m3!1d14628.168890725177!2d-46.8106739!3d-23.566927!3m2!1i1024!2i768!4f13.1!3m3!1m2!1s0x94ceff0170878693%3A0x6b87459f7a1d7b94!2sPin%20Osasco%20Residencial%20Clube!5e0!3m2!1spt-BR!2sbr!4v1699018902594!5m2!1spt-BR!2sbr"" width=""600"" height=""450"" style=""border:0;"" allowfullscreen="""" loading=""lazy"" referrerpolicy=""no-referrer-when-downgrade""></iframe>",2,"a:2:{i:0;s:7:""0-vagas"";i:1;s:6:""1-vaga"";}",5,230511,"a:1:{i:0;s:7:""em-obra"";}"
230539,"The Way",apartamento,"R. Antônio Rinaldi, 50 - Jaguaribe, Osasco - SP","R$ 280.000,00",osasco,"a:2:{i:0;s:8:""1-quarto"";i:1;s:9:""2-quartos"";}","Qualidade de vida é ter tudo bem perto de você.","A excelente localização do THE WAY reúne todas as características que tornarão seus dias mais práticos e dinâmicos. Uma região em constante desenvolvimento, com grande potencial de valorização, pronta para lhe oferecer um leque de opções de comércios, serviços, entretenimento e lazer.","<iframe src=""https://www.google.com/maps/embed?pb=!1m18!1m12!1m3!1d3657.3900766841984!2d-46.79219542582532!3d-23.554429861335354!2m3!1f0!2f0!3f0!3m2!1i1024!2i768!4f13.1!3m3!1m2!1s0x94ceff833056d4b3%3A0x387ae226f803db9b!2sR.%20Ant%C3%B4nio%20Rinaldi%2C%2050%20-%20Jaguaribe%2C%20Osasco%20-%20SP%2C%2006065-150!5e0!3m2!1spt-BR!2sbr!4v1699027507661!5m2!1spt-BR!2sbr"" width=""600"" height=""450"" style=""border:0;"" allowfullscreen="""" loading=""lazy"" referrerpolicy=""no-referrer-when-downgrade""></iframe>",1,"a:1:{i:0;s:6:""1-vaga"";}",2,230547,"a:1:{i:0;s:7:""em-obra"";}"
230558,Station,apartamento,"Av. Comandante Sampaio, 685 - Km 18, Osasco - SP","R$ 250.000,00",osasco,"a:2:{i:0;s:8:""1-quarto"";i:1;s:9:""2-quartos"";}","Esporte Vida e Lazer","Sua estação de felicidade, saúde e momentos inesquecíveis.","<iframe src=""https://www.google.com/maps/embed?pb=!1m14!1m8!1m3!1d14632.549529082828!2d-46.7988928!3d-23.5275607!3m2!1i1024!2i768!4f13.1!3m3!1m2!1s0x94ceffba5364527d%3A0xb657b181781e987d!2sStation%20KM18!5e0!3m2!1spt-BR!2sbr!4v1699033443174!5m2!1spt-BR!2sbr"" width=""600"" height=""450"" style=""border:0;"" allowfullscreen="""" loading=""lazy"" referrerpolicy=""no-referrer-when-downgrade""></iframe>",1,"a:1:{i:0;s:6:""1-vaga"";}",2,230577,"a:1:{i:0;s:6:""pronto"";}"
230584,"Giardino Golf Residenziale",apartamento,"Av. Dr. Martin Luther King, 605 - Vila Sao Francisco, Osasco - SP","R$ 783.000,00",osasco,"a:2:{i:0;s:9:""2-quartos"";i:1;s:9:""3-quartos"";}","Exclusividade e elegância, na região mais nobre de Osasco","Muito conforto, segurança, exclusividade e lazer super completo.
Tudo isso com o privilégio de uma vista exuberante ao verde.","<iframe src=""https://www.google.com/maps/embed?pb=!1m18!1m12!1m3!1d3657.4418037291925!2d-46.77349172360006!3d-23.552570961271325!2m3!1f0!2f0!3f0!3m2!1i1024!2i768!4f13.1!3m3!1m2!1s0x94cefff837d6304b%3A0x2a7d4801d9212354!2sGiardino%20Golf%20Residenziale!5e0!3m2!1spt-BR!2sbr!4v1699100042368!5m2!1spt-BR!2sbr"" width=""600"" height=""450"" style=""border:0;"" allowfullscreen="""" loading=""lazy"" referrerpolicy=""no-referrer-when-downgrade""></iframe>",1,"a:2:{i:0;s:6:""1-vaga"";i:1;s:7:""2-vagas"";}",1,230596,"a:1:{i:0;s:7:""em-obra"";}"
230614,"Mix Altino",apartamento,"R. Armênia, 518 - Pres. Altino, Osasco - SP","R$ 252.000,00",osasco,"a:3:{i:0;s:9:""3-quartos"";i:1;s:9:""2-quartos"";i:2;s:8:""1-quarto"";}","Um mix de possibilidades para você!","Que tal ter uma experiência completa com mais de 20 itens de lazer e serviços em um só lugar? Com muita segurança e comodidade, o Mix Altino oferece infraestrutura completa e apartamentos com terraço gourmet, ambientes integrados e lavabo. Além de muita mobilidade, com fácil acesso à Estação Presidente Altino, Marginal Pinheiros e Tietê e também à Rod. Castelo Branco.
","<iframe src=""https://www.google.com/maps/embed?pb=!1m18!1m12!1m3!1d3658.1783144153483!2d-46.76958132360103!3d-23.526088160299306!2m3!1f0!2f0!3f0!3m2!1i1024!2i768!4f13.1!3m3!1m2!1s0x94ceff27eb41c9c1%3A0xbb71e8d31bd41704!2sMix%20Altino%20-%20Zafir!5e0!3m2!1spt-BR!2sbr!4v1699101584481!5m2!1spt-BR!2sbr"" width=""600"" height=""450"" style=""border:0;"" allowfullscreen="""" loading=""lazy"" referrerpolicy=""no-referrer-when-downgrade""></iframe>",3,"a:2:{i:0;s:7:""2-vagas"";i:1;s:6:""1-vaga"";}",4,230647,"a:1:{i:0;s:7:""em-obra"";}"
230651,"Enjoy Home Club",apartamento,"Av. Capistrano de Abreu, 988 - Jaguaribe, Osasco - SP","R$ 324.000,00",osasco,"a:3:{i:0;s:9:""3-quartos"";i:1;s:9:""2-quartos"";i:2;s:8:""1-quarto"";}","Aproveite os melhores momentos da vida no Enjoy","Um espaço completo para você. More em um Home Club e viva momentos inesquecíveis todos os dias. O Enjoy reserva os principais pilares para o seu bem-estar: mobilidade, conforto e infraestrutura para você e sua família.","<iframe src=""https://www.google.com/maps/embed?pb=!1m18!1m12!1m3!1d3657.2424348917216!2d-46.79443912360007!3d-23.559734861534647!2m3!1f0!2f0!3f0!3m2!1i1024!2i768!4f13.1!3m3!1m2!1s0x94ceff53580876ab%3A0x35245e2843d96a3e!2sEnjoy%20Home%20Club!5e0!3m2!1spt-BR!2sbr!4v1699105335098!5m2!1spt-BR!2sbr"" width=""600"" height=""450"" style=""border:0;"" allowfullscreen="""" loading=""lazy"" referrerpolicy=""no-referrer-when-downgrade""></iframe>",1,"a:1:{i:0;s:7:""2-vagas"";}",3,230678,"a:1:{i:0;s:7:""em-obra"";}"
230679,"Station 2",apartamento,"Av. Cmte. Sampaio, 588 - Km 18, Osasco - SP","R$ 220.000,00",osasco,"a:1:{i:0;s:9:""2-quartos"";}","Esporte, vida & lazer.","Aqui, tranquilidade, segurança e bem-estar vão fazer parte do seu cotidiano.","<iframe src=""https://www.google.com/maps/embed?pb=!1m14!1m8!1m3!1d14632.565151398117!2d-46.7978769!3d-23.5274202!3m2!1i1024!2i768!4f13.1!3m3!1m2!1s0x94ceff15afad880d%3A0x230dd4013906fa26!2sStation%202!5e0!3m2!1spt-BR!2sbr!4v1699196825831!5m2!1spt-BR!2sbr"" width=""600"" height=""450"" style=""border:0;"" allowfullscreen="""" loading=""lazy"" referrerpolicy=""no-referrer-when-downgrade""></iframe>",5,"a:2:{i:0;s:7:""0-vagas"";i:1;s:6:""1-vaga"";}",7,230694,"a:1:{i:0;s:7:""em-obra"";}"
230698,"Sole Bela Vista",apartamento,"R. Antônia Bizarro, 201 - Bela Vista, Osasco - SP","R$ 5500.000,00",osasco,"a:2:{i:0;s:9:""2-quartos"";i:1;s:9:""3-quartos"";}","O charme o privilégio de morar no bela vista","More em uma rua tranquila, no coração do Bela Vista, a poucos passos de tudo o que você mais precisa para seu dia a dia. 

Uma região que se valoriza a cada dia com investimentos em infraestrutura, cercada de ampla rede de comércio e serviços, com inúmeras conexões de acesso ao seu dispor.","<iframe src=""https://www.google.com/maps/embed?pb=!1m18!1m12!1m3!1d3657.762158531513!2d-46.78311472467049!3d-23.541055378813848!2m3!1f0!2f0!3f0!3m2!1i1024!2i768!4f13.1!3m3!1m2!1s0x94ceff8b01762d83%3A0x6c7586c74d30b8ca!2sSole%20Bela%20Vista%20%7C%20Obra!5e0!3m2!1spt-BR!2sbr!4v1699200972095!5m2!1spt-BR!2sbr"" width=""600"" height=""450"" style=""border:0;"" allowfullscreen="""" loading=""lazy"" referrerpolicy=""no-referrer-when-downgrade""></iframe>",2,"a:2:{i:0;s:6:""1-vaga"";i:1;s:7:""2-vagas"";}",3,230699,"a:1:{i:0;s:7:""em-obra"";}"
230723,Celebra,apartamento,"R. Francisco Haro Alaminos, 234 - Ayrosa, Osasco - SP","R$ 320.000,00",osasco,"a:2:{i:0;s:8:""1-quarto"";i:1;s:9:""2-quartos"";}","Celebre a vida e seus melhores momentos.","A vida pede mais do que uma boa localização.","<iframe src=""https://www.google.com/maps/embed?pb=!1m14!1m8!1m3!1d14633.548857533833!2d-46.7711002!3d-23.5185716!3m2!1i1024!2i768!4f13.1!3m3!1m2!1s0x94ceffb0bd637b1f%3A0xd140ebf5f8ae97b4!2sCelebra%20Osasco!5e0!3m2!1spt-BR!2sbr!4v1699207523069!5m2!1spt-BR!2sbr"" width=""600"" height=""450"" style=""border:0;"" allowfullscreen="""" loading=""lazy"" referrerpolicy=""no-referrer-when-downgrade""></iframe>",1,"a:2:{i:0;s:7:""0-vagas"";i:1;s:6:""1-vaga"";}",3,230759,"a:1:{i:0;s:7:""em-obra"";}"
230777,MOBI,apartamento,"R. Passagem Ângelo Bianchy, 290 - Centro, Osasco - SP, 06018-150","R$ 315.000,00",osasco,"a:2:{i:0;s:8:""1-quarto"";i:1;s:9:""2-quartos"";}","Porque a vida pede MOBILIDADE.","Um bairro cercado de todas as facilidades","<iframe src=""https://www.google.com/maps/embed?pb=!1m18!1m12!1m3!1d3657.7557898638743!2d-46.77701222375358!3d-23.54128436085674!2m3!1f0!2f0!3f0!3m2!1i1024!2i768!4f13.1!3m3!1m2!1s0x94ceff9f95898707%3A0x64ebced34d40908d!2sMobi%20Bela%20Vista!5e0!3m2!1spt-BR!2sbr!4v1699209322361!5m2!1spt-BR!2sbr"" width=""600"" height=""450"" style=""border:0;"" allowfullscreen="""" loading=""lazy"" referrerpolicy=""no-referrer-when-downgrade""></iframe>",1,"a:2:{i:0;s:7:""0-vagas"";i:1;s:6:""1-vaga"";}",2,230725,"a:1:{i:0;s:6:""pronto"";}"
230778,"Viva RSF",apartamento,"Av. Doná Blandina Ignêz Júlio, 710 - Jaguaribe, Osasco - SP","R$ 280.000,00",osasco,"a:3:{i:0;s:9:""3-quartos"";i:1;s:9:""2-quartos"";i:2;s:8:""1-quarto"";}","Tudo para você viver bem. Tudo para você viver o seu melhor.","O seu estilo de viver é próprio, é único. Ele guia o seu modo de agir e pensar. É o jeito como você vê a vida. É a sua forma de curtir, de amar, de relaxar, de se expressar, de encontrar o que realmente importa para você, de encarar e superar desafios, de transformar os seus melhores momentos nos motivos que fazem tudo
valer a pena. 

Por isso, o lugar escolhido para você viver deve refletir os seus gostos e atender a todas as suas vontades e necessidades. Criada pela RSF, VIVA é mais do que uma linha de empreendimentos, é um conceito de viver, que foi desenvolvido pensando em você e no seu momento. Agora, tudo isso está presente no VIVA RSF JAGUARIBE, um projeto que chega para oferecer um jeito moderno, prático e confortável de morar, com lazer, mobilidade e uma completa infraestrutura à sua volta. ","<iframe src=""https://www.google.com/maps/embed?pb=!1m18!1m12!1m3!1d3657.167729884062!2d-46.7898412!3d-23.5624187!2m3!1f0!2f0!3f0!3m2!1i1024!2i768!4f13.1!3m3!1m2!1s0x94ceff80eb5c9a9d%3A0x68aee982c83445ec!2sAv.%20Don%C3%A1%20Blandina%20Ign%C3%AAz%20J%C3%BAlio%2C%20710%20-%20Jaguaribe%2C%20Osasco%20-%20SP%2C%2006050-120!5e0!3m2!1spt-BR!2sbr!4v1699211304136!5m2!1spt-BR!2sbr"" width=""600"" height=""450"" style=""border:0;"" allowfullscreen="""" loading=""lazy"" referrerpolicy=""no-referrer-when-downgrade""></iframe>",2,"a:2:{i:0;s:6:""1-vaga"";i:1;s:7:""2-vagas"";}",3,230787,"a:1:{i:0;s:7:""em-obra"";}"
230824,Look,apartamento,"R. Águas da Prata, 246 - Rochdale, Osasco - SP","R$ 235.000,00",osasco,"a:2:{i:0;s:8:""1-quarto"";i:1;s:9:""2-quartos"";}","Sinta-se nas alturas","A menor distância entre MOBILIDADE, CONFORTO e PRATICIDADE. Uma região com infraestrutura completa, onde a diversidade de comércio e serviços farão parte da comodidade do seu dia a dia. 

Todos os olhares voltados a imponência de um projeto grandioso. Segurança planejada e comodidade vão fazer parte da sua vida.","<iframe src=""https://www.google.com/maps/embed?pb=!1m14!1m8!1m3!1d14633.969243569572!2d-46.7786215!3d-23.5147892!3m2!1i1024!2i768!4f13.1!3m3!1m2!1s0x94ceff6a9669d609%3A0x8c2fdfc9b45bedd8!2sLook%20Condom%C3%ADnio%20Clube!5e0!3m2!1spt-BR!2sbr!4v1699215830673!5m2!1spt-BR!2sbr"" width=""600"" height=""450"" style=""border:0;"" allowfullscreen="""" loading=""lazy"" referrerpolicy=""no-referrer-when-downgrade""></iframe>",2,"a:1:{i:0;s:6:""1-vaga"";}",3,230825,"a:1:{i:0;s:7:""em-obra"";}"
